[
 {
  "name": "Alarm",
  "class": "Wizard",
  "level": 1,
  "school": "Abjuration, Evocation",
  "sphere": "",
  "casting_time": "1 rd.",
  "range": "10 yds.",
  "duration": "4 hrs. + _ hr./level",
  "area_of_effect": "Up to 20-ft. cube",
  "components": "V, S, M",
  "saving_throw": "None",
  "description": "When an alarm spell is cast, the wizard causes a selected area to react to the presence of any creature larger than a normal rat--anything larger than about _ cubic foot in volume or more than about three pounds in weight. The area of effect can be a portal, a section of floor, stairs, etc. As soon as any creature enters the warded area, touches it, or otherwise contacts it without speaking a password established by the caster, the alarm spell lets out a loud ringing that can be heard clearly within a 60-foot radius. (Reduce the radius by 10 feet for each interposing door and by 20 feet for each substantial interposing wall.) The sound lasts for one round and then ceases. Ethereal or astrally projected creatures do not trigger an alarm, but flying or levitating creatures, invisible creatures, or incorporeal or gaseous creatures do. The caster can dismiss the alarm with a single word.The material components of this spell are a tiny bell and a piece of very fine silver wire."
 },
 {
  "name": "Armor",
  "class": "Wizard",
  "level": 1,
  "school": "Conjuration",
  "sphere": "",
  "casting_time": "1 rd.",
  "range": "Touch",
  "duration": "Special",
  "area_of_effect": "1 creature",
  "components": "V, S, M",
  "saving_throw": "None",
  "description": "By means of this spell, the wizard creates a magical field of force that serves as if it were scale mail armor (AC 6). The spell has no effect on a person already armored or a creature with Armor Class 6 or better. It is not cumulative with the shield spell, but it is cumulative with Dexterity and, in case of fighter/mages, with the shield bonus. The armor spell does not hinder movement or prevent spellcasting, and adds no weight or encumbrance. It lasts until successfully dispelled or until the wearer sustains cumulative damage totaling greater than 8 points + 1 per level of the caster. (It is important to note that the armor does not absorb this damage. The armor merely grants an AC of 6; the wearer still suffers full damage from any successful attacks.) Thus, the wearer might suffer 8 points from an attack, then several minutes later sustain an additional 1 point of damage. Unless the spell were cast by a wizard of 2nd level or higher, it would be dispelled at this time. Until it is dispelled, the armor spell grants the wearer full benefits of the Armor Class gained. The material component is a piece of finely cured leather that has been blessed by a priest."
 },
 {
  "name": "Burning Hands",
  "class": "Wizard",
  "level": 1,
  "school": "Alteration",
  "sphere": "",
  "casting_time": "1",
  "range": "0",
  "duration": "Instantaneous",
  "area_of_effect": "The caster",
  "components": "V, S",
  "saving_throw": "1/2",
  "description": "When the wizard casts this spell, a jet of searing flame shoots from his fingertips. His hands must be held so as to send forth a fanlike sheet of flames: The wizard's thumbs must touch each other and the fingers must be spread. The burning hands send out flame jets 5 feet long in a horizontal arc of about 120 degrees in front of the wizard. Any creature in the area of the flames suffers 1d3 points of damage, plus 2 points for each level of experience of the spellcaster, to a maximum of 1d3+20 points of fire damage. Those successfully saving vs. spell receive half damage. Flammable materials touched by the fire burn (for example, cloth, paper, parchment, thin wood, etc.). Such materials can be extinguished in the next round if no other action is taken."
 },
 {
  "name": "Chromatic Orb",
  "class": "Wizard",
  "level": 1,
  "school": "Alteration, Evocation",
  "sphere": "",
  "casting_time": "1",
  "range": "0",
  "duration": "Special",
  "area_of_effect": "One creature",
  "components": "V, S, M",
  "saving_throw": "Neg.",
  "description": "This spell causes a 4-inch-diameter sphere to appear in the caster's hand. Within the limits described below, the sphere can appear in a variety of colors; each color indicates a different special power. The caster can hurl the sphere at an opponent up to 30 yards away, providing there are no barriers between the caster and the target.  If the target is no more than 10 yards away, the caster's to hit roll is made with a +3 bonus.  If the target is 10-20 yards away, the caster's roll is made with a +2 bonus. If the target is 20-30 yards away, the caster's roll is made with a +1 bonus.    If the chromatic orb misses its target, it dissipates without effect. If the target creature makes a successful saving throw, the chromatic orb is also ineffective. Otherwise, the color of the orb determines the amount of damage inflicted and its special power, as summarized on Table 16; details about the special powers are listed below.  The caster can create a single orb of any color listed for his level or lower; for instance, a 3rd-level wizard can create an orange, red, or white orb.   The material component for this spell is a gem of the appropriate hue or any diamond. The gem must have a value of at least 50 gp.     Light from the orb causes the victim to become surrounded by light to a radius of 20 feet, as if affected by a light spell. The effect lasts for 1 round, during which time the victim makes his attack rolls and saving throws at a -4 penalty, and his AC is penalized by 4.    Heat from the orb is intense enough to melt 1 cubic yard of ice. The victim suffers a loss of 1 point of Strength and 1 point of Dexterity (or for victims without these attributes, -1 to hit and a penalty of 1 to AC) for 1 round.    Fire from the orb ignites all combustible materials within 3 feet of the victim.    Blindness from the orb causes the victim to become blind as per the spell. The effect lasts for 1 round/level of the caster.    Stinking cloud from the orb surrounds the victim in a 5-foot-radius noxious cloud. The victim must save vs. poison or will be reeling and unable to attack until he leaves the area of the vapors.   Magnetism from the orb has an effect only if the victim is wearing armor made from iron. The iron armor becomes magically magnetized for 3-12 (3d4) rounds. Other iron objects within 3 feet of the caster will stick tight to the magnetized armor; only dispel magic or a similar spell can release the stuck items. At the end of the spell's duration, the stuck items are released.    Paralysis from the orb causes the victim to become paralyzed for 6-20 (2d8 + 4) rounds; a successful saving throw vs. paralyzation halves the number of rounds.    Petrification from the orb turns the victim to stone. If the victim successfully saves vs. petrification, he avoids turning to stone and instead is slowed (as per the spell) for 2-8 (2d4) rounds.   Death from the orb causes the victim to die. If the victim successfully saves. vs death magic, he avoids death and instead is paralyzed for 2-5 (1d4 +1) rounds.  Table 16: Chromatic Orb Effects  Level of  Color of Orb  Hit Points  Special Caster  Generated  of Damage  Power  s   White  1-4  Light  n   Red  1-6  Heat  r   Orange  1-8  Fire  t   Yellow  1-10  Blindness  t   Green  1-12  Stinking Cloud  t   Turquoise  2-8  Magnetism  t   Blue  2-16  Paralysis  t   Violet  slow  Petrification  t   Black  paralysis  Death"
 },
 {
  "name": "Enlarge",
  "class": "Wizard",
  "level": 1,
  "school": "Alteration",
  "sphere": "",
  "casting_time": "1",
  "range": "5 yds./level",
  "duration": "5 rds./level",
  "area_of_effect": "1 creature or object",
  "components": "V, S, M",
  "saving_throw": "Neg.",